Name,Country,Start year,End year,Proven victims,Possible victims,Notes,Decade,Career_Length,Victims_Per_Year
Anthony Hardy,United Kingdom,2002,2011,3,8,"Known as the ""Camden Ripper"", killed and dismembered three sex workers in Camden, London in 2002. Police believe he could be responsible for the murders of three other sex workers in London in the 1990s and two others in Nottinghamshire. One other unsolved murder he was linked to was solved in 2011 when her former partner John Sweeney was convicted of her murder.",2000,9,0.3333333333333333
Michael Lee Lockhart,United States,1987,1988,3,6,"Multi-state serial killer who received death sentences in three states (Florida, Indiana, and Texas). He was executed in 1997 in Texas.",1980,1,3.0
Peter Dupas,Australia,1997,1999,3,6,"Sexual sadist from Melbourne, who murdered three women and is suspected of at least three further killings. Was convicted of 16 separate acts of sexual violence before his first murder charge. Serving three consecutive life sentences without the possibility of parole.",1990,2,1.5
Stephen Griffiths,United Kingdom,2009,2010,3,6,"Known to have killed three sex workers, but claimed to police to have killed 6. Has been a suspect in one other murder. Dubbed himself the ""Crossbow Cannibal"" as he killed his victims with a hammer and crossbow and then later ate parts of them.",2000,1,3.0
Levi Bellfield,United Kingdom,2002,2004,3,6,"West London serial killer convicted of two fatal hammer attacks on women and the murder of Milly Dowler. Also a suspect in the murders of his childhood girlfriend Patsy Morris in 1980, Judith Gold, who was hit over the head in 1990, and Elizabeth Chau, who disappeared in 1999 and whose murder Bellfield has allegedly confessed to.",2000,2,1.5
Hans van Zon,Netherlands,1967,1976,3,5,"After the relationship between Hans van Zon and his girlfriend ended in April 1967, van Zon alleged that she continued to impose on him. To put an end to this, he went into her house and killed her with a self-made lead pipe. He also killed an 80-year-old shopkeeper, and a milkman in robberies. In addition to the murders he was tried for, van Zon was also suspected of several other murders, including the lust murder of Elly Segov in 1964 and the murder of the English homosexual film director Claude Berkeley in 1965.",1960,9,0.3333333333333333
Judy Buenoano,United States,1971,1980,3,5,"Poisoned her husband, boyfriend and son with arsenic; drowned the son in 1980 but caught in 1983 after poisoning and car bombing a fiancée.",1970,9,0.3333333333333333
Martin Ney,Germany,1992,2004,3,5,Wore a mask while killing 3 and sexually assaulting at least 40 children.,1990,12,0.25
Paul Denyer,Australia,1993,2002,3,5,"The ""Frankston Killer"", sentenced to three consecutive life sentences with a non-parole period of 30 years.",1990,9,0.3333333333333333
Bandali Debs,Australia,1997,1998,3,5,"Convicted of the murder of Kirsty Harty at Upper Beaconsfield in 1997, and of the Moorabbin Police murders 14 months later to avoid arrest for a string of armed robberies; sentenced to three consecutive life sentences plus 27 years without the possibility of parole.",1990,1,3.0
Gordon Northcott,United States,1928,1937,3,12,"Pedophile who abducted and murdered boys aged between 10 and 12 in Los Angeles and then disposed of the bodies with the help of his mother, Sarah Louise Northcott, and his underage nephew Sanford Clark, whom Northcott had repeatedly threatened and sexually abused. Police considered Northcott a suspect in the disappearance of as many as 20 missing boys in the area that Northcott admitted to have molested, but not murdered; one of these boys surfaced years later alive and confirmed Northcott's version. According to Clark, only four boys were held and murdered in Northcott's property; the three LA children whose remains were found and for whom Northcott was hanged, and an unidentified Mexican boy that Northcott beheaded and disposed of the body near La Puente, California.",1920,9,0.3333333333333333
Peter Kudzinowski,United States,1924,1928,3,4,"Convicted and executed for the murder of an adult in Scranton, Pennsylvania and two children in New Jersey. Also suspect in the death of two other children in New York City, although Albert Fish later confessed to have murdered one of them himself.",1920,4,0.75
Harvey Glatman,United States,1957,1958,3,4,"Known as ""The Lonely Hearts Killer""; Californian rapist and killer; lured women to pose for ""bondage photographs""; executed in the gas chamber on September 18, 1959.",1950,1,3.0
Martha Ann Johnson,United States,1977,1982,3,4,"Convicted of smothering three of her children in Atlanta between 1977 and 1982. Sentenced to life in prison on May 5, 1990.",1970,5,0.6
Vlado Taneski,Republic of Macedonia,2005,2008,3,4,"A crime journalist, Taneski came under suspicion when his articles on the rape and murder of three elderly women included information that had not been disclosed by the police. All the victims were poor, uneducated cleaners and knew Taneski's mother. Taneski killed himself in prison before he could be interrogated for the murder of a fourth woman.",2000,3,1.0
Özkan Zengin,Turkey,2008,2017,3,4,Slit the throats of three confirmed victims before dumping the bodies in wells. Reportedly confessed to an additional murder.,2000,9,0.3333333333333333
Khalil Wheeler-Weaver,United States,2016,2025,3,4,"American serial killer from Orange, New Jersey, Wheeler-Weaver lured his victims using dating apps and murdered three women and attempted to kill a fourth between August 2016 and November 2016. One of the victim's friends created a fake account and lured him to a meeting before notifying police.",2010,9,0.3333333333333333
William Henry Hance,United States,1977,1978,3,4,Hance murdered three women in and around military bases in the late 1970s. He attempted to blame two of the murders on white vigilantes outraged over a series of murders later attributed to Carlton Gary. Hance was also blamed for the murder of a fourth woman at Fort Benjamin Harrison in Indiana but was never brought to trial for this crime.,1970,1,3.0
"""Charlie Chop-off""",United States,1972,1973,3,4,"Unidentified assailant who attacked young black and Puerto Rican boys and mutilated their genitals with a straight razor, killing three and leaving one castrated. Another suspected victim was killed but did not have his genitals mutilated. A single suspect was arrested for attempting to abduct another boy, confessed to one of the murders and was hesitantly identified by the surviving victim, but was found unfit for trial and may have been in a mental hospital during the murders.",1970,1,3.0
François Vérove,France,1986,1994,3,6,"Nicknamed ""Le Grêlé"" (""the pockmarked man""), Verove a former police officer is blamed for four murders and a series of rapes since 1986. His confessed was found on his suicide note alongside body after he killed himself in 2021. The crimes include the 1986 murder of an 11-year-old child, Cécile Bloch, in Paris.",1980,8,0.375
Louise Peete,United States,1912,1942,3,3,"Convicted of murdering a man and woman decades apart, four other acquaintances died suspiciously and four husbands committed suicide.",1910,30,0.1
Westley Allan Dodd,United States,1989,1998,3,3,"Dodd had an extensive arrest record for molesting children by the time his behavior escalated to include murder. Refusing to appeal his death sentence, he stated that he ""should be punished to the full extent of the law, as should all sex offenders and murderers"", and that if he ever escaped, he would immediately return to ""killing and raping kids"". Executed in 1993; his hanging was the first in the United States in 28 years.",1980,9,0.3333333333333333
Scott Erskine,United States,1989,1993,3,3,Convicted of raping and murdering a woman in 1989 and the torture-murders of 2 boys in 1993. May be linked to other murders.,1980,4,0.75
Donald Leroy Evans,United States,1985,1991,3,3,"Murdered a young girl and two women. Suspected of another dozen murders but recanted confessions to over 70 more. Stabbed to death by another death row inmate on January 5, 1999.",1980,6,0.5
John Martin,United Kingdom,1995,2004,3,3,"(Birth name John Martin Scripps, alias Simon James Davis) While on the run after escaping Britain, Martin killed at least three tourists between 8 and 14 March 1995 and robbed them of their possessions and money: one in Singapore and two in Thailand. He also dismembered their bodies and dumped them in various areas, such as the sea or abandoned places. Martin was also alleged to have killed at least three more people in other countries, such as the US, but these were unconfirmed. He was arrested in Changi Airport when he returned to Singapore on 19 March 1995, and was charged with murder. Martin was found guilty of the one murder he committed in Singapore and thus sentenced to death in November 1995. Martin was executed on 19 April 1996, after he declined to appeal against his sentence.",1990,9,0.3333333333333333
Richard Evonitz,United States,1996,1997,3,3,"Abducted and killed 3 girls in Spotsylvania County, Virginia in 1996 and 1997",1990,1,3.0
Harvey Carignan,United States,1949,1974,3,3,"Serving a life sentence at the Minnesota Correctional Facility – Faribault for the murders of two women. He had been previously convicted for a 1949 rape and murder he committed while stationed in the U.S. Army, in Anchorage, Alaska.",1940,25,0.12
John Joubert,United States,1982,1983,3,3,Joubert killed a young boy in Maine and two boys in Nebraska. He was executed by the State of Nebraska in 1996.,1980,1,3.0
Akku Yadav,India,0,2004,3,3,Murdered at least three people and dumped their bodies on the railroad tracks; lynched by a mob of around 200 women.,0,0,0.0
Michael Madison,United States,2012,2013,3,3,"American serial killer from East Cleveland, Ohio who committed at least three murders.",2010,1,3.0
"""Bible John""",United Kingdom,1968,1969,3,3,"Unidentified serial killer who murdered three women in Glasgow, Scotland. Convicted serial killer Peter Tobin was suspected in the murders, but has since been eliminated as a suspect.",1960,1,3.0
Andrew Dawson,United Kingdom,1982,2010,3,3,"Killed an elderly man during a burglary in 1982. Following his release from prison, he stabbed two of his neighbors to death in separate incidents, describing himself as an ""Angel of Mercy"". He is currently Derby's only serial killer.",1980,28,0.10714285714285714
Leonarda Cianciulli,Italy,1939,1940,3,3,"Murdered three women in the town of Correggio, Reggio Emilia, and turned their bodies into soap and cakes.",1930,1,3.0
Sharon Kinne,United States,1960,1964,3,3,Sociopathic serial killer that murdered romantic partners with a handgun. Currently still at large since her escape from prison in 1969.,1960,4,0.75
Ted Kaczynski,United States,1978,1995,3,3,"Domestic terrorist and serial bomber known as the ""Unabomber"", Kaczynski was responsible for more than two dozen bombings of universities and one airline bombing from 1978 to 1996, justified by Kaczynski by his philosophy that technological advancements would destroy humanity. Arrested in 1996 due to his brother David recognizing the then unidentified Unabomber's manifesto titled Industrial Society and Its Future as the work of Kaczynski. Died in prison on June 10, 2023.",1970,17,0.17647058823529413
Leon Dorsey,United States,1994,2003,3,3,"Murdered three people from 4 April-11 September 1994. He was serving 60 years for the murder of an Ellis County convenience store employee when surveillance camera footage linked him to the murders of two other people. He was convicted and sentenced to death in June 2000, and executed on 12 August 2008.",1990,9,0.3333333333333333
Ronald Jebson,United Kingdom,1970,1974,3,3,"Jebson, a prolific child molester, was convicted of raping and killing the eight-year-old daughter of acquaintances in 1974. While serving his sentence he pled guilty to molesting and murdering two other children, Susan Blatchford and Gary Hanlon, in 1970.",1970,4,0.75
Charles Albanese,United States,1980,1981,3,3,"Albanese poisoned his wife's mother and grandmother and his father with arsenic in order to obtain inheritance money, and unsuccessfully tried to poison his brother and mother. He was sentenced to death in two separate trials and ultimately executed in 1995.",1980,1,3.0
George Chapman,United Kingdom,1897,1902,3,3,Poisoned three consecutive mistresses with tartar emetic. Considered the possible identity of Jack the Ripper at the time of his execution (1903).,1890,5,0.6
Martha Rendell,Australia,1907,1908,3,3,Killed three stepchildren with hydrochloric acid in the 20th century; last woman to be hanged in Western Australia.,1900,1,3.0
George Joseph Smith,United Kingdom,1912,1914,3,3,"Known as ""The Brides in the Bath Murders""; killer of three women. Executed by hanging on August 13, 1915.",1910,2,1.5
Daisy de Melker,South Africa,1923,1932,3,3,Poisoner; killed two husbands and one son from 1923 to 1932.,1920,9,0.3333333333333333
Eddie Leonski,Australia,1942,1951,3,3,Confessed to three murders after being picked out of a line of American servicemen by witnesses. Sentenced to death and hanged.,1940,9,0.3333333333333333
William Heirens,United States,1945,1946,3,3,"Burglar who stabbed three females between. Known as ""The Lipstick Killer"".",1940,1,3.0
John Straffen,United Kingdom,1951,1952,3,3,Killed his third victim after escaping from the mental hospital where he was recluded for the first two murders. Longest-held prisoner in modern British history at the time of his death in 2007.,1950,1,3.0
Richard Laurence Marquette,United States,1961,1975,3,3,"First 11th name on FBI 10 Most Wanted for killing, mutilating and dismembering a woman in 1961; killed two more with same MO upon 1973 release.",1960,14,0.21428571428571427
Graham Young,United Kingdom,1962,1971,3,3,"Called the ""Teacup Poisoner"". Poisoned over 70 people, 3 of whom died.",1960,9,0.3333333333333333
Charles Schmid,United States,1964,1965,3,3,"Known as ""The Pied Piper of Tucson""; murdered three teenage girls in 1964 and 1965 and buried them in the desert.",1960,1,3.0
Lee Roy Martin,United States,1967,1968,3,3,"Known as ""The Gaffney Strangler""; killed two women and two girls in South Carolina in 1967 and 1968.",1960,1,3.0
Erwin Hagedorn,East Germany,1969,1971,3,3,Killed three boys ages 9 to 12. Was convicted and executed in 1972.,1960,2,1.5
Karl F. Warner,United States,1969,1971,3,3,"Convicted of murdering three teenage girls, in two separate incidents, in the San Francisco Bay Area communities of San Jose and Saratoga, he was briefly suspected of being the notorious Zodiac Killer, but was soon ruled out as a suspect in that case.",1960,2,1.5
Howard Arthur Allen,United States,1974,1987,3,3,"Killed three elderly people, as well as assault, burglary, and arson. Sentenced to death June 11, 1988.",1970,13,0.23076923076923078
Trevor Hardy,United Kingdom,1974,1976,3,3,"Called ""The Monster of Manchester"". Died in prison in 2012.",1970,2,1.5
Steven David Catlin,United States,1976,1984,3,3,Poisoned three people from 1976 to 1984. Sentenced to death in 1990.,1970,8,0.375
Paul Michael Stephani,United States,1980,1982,3,3,"Known as ""The Weepy-Voiced Killer""; would call police and ask for help after murders. Killed 3 women in the cities of Saint Paul and Minneapolis, Minnesota.",1980,2,1.5
Dámaso Rodríguez Martín,Spain,1981,1991,3,3,"Serial rapist and voyeur known as ""The Warlock"". After being sentenced to 55 years for murdering a man and raping his girlfriend in 1981, he escaped from prison in 1991 and fled to the Anaga mountains in Tenerife, where he killed a couple of German hikers (the woman was also raped). Cornered in an abandoned house, Martín shot himself unsuccessfully and was then shot dead by law enforcement.",1980,10,0.3
Altemio Sanchez,United States,1981,2006,3,3,"Known as ""The Bike Path Rapist"" for murdering three women and raping at least 14 others in and around the Buffalo, New York area. Sentenced to 75 years in prison without the possibility of parole.",1980,25,0.12
Gregory Brazel,Australia,1982,1990,3,3,Shot dead a woman in 1982 armed robbery and murdered two sex workers in 1990.,1980,8,0.375
Brian Dugan,United States,1983,1985,3,3,Convicted of murdering 2 girls and a woman between 1983 and 1985.,1980,2,1.5
Valery Asratyan,Soviet Union,1988,1990,3,3,"Raped dozens of women in Moscow, murdering three. Executed.",1980,2,1.5
Francisca Ballesteros,Spain,1990,2004,3,3,"""The Black Widow of Valencia"". Poisoned her husband and three children, one of whom survived. Sentenced to 85 years in prison in 2005.",1990,14,0.21428571428571427
Silvo Plut,"SR Slovenia, Serbia and Montenegro, Slovenia",1990,2006,3,3,"After serving 13 years in prison in Slovenia for a rape and murder, Plut murdered a second woman in Serbia in 2004 and fled back to Slovenia, where a Serbian petition of extradition was turned down by the government. Plut was then arrested for attacking a couple (wife died, husband survived) and sentenced to 30 years in prison. Committed suicide in 2007.",1990,16,0.1875
Gabriel Garza Hoth,Mexico,1991,1998,3,3,"Known as ""The Black Widower"", killed 3 women between 1991 and 1998, his victims were wives and lovers.",1990,7,0.42857142857142855
Robert Napper,United Kingdom,1992,1993,3,3,"Rapist and murderer who mutilated one of his victims so badly that the policeman who found her was put into therapy for two years. Suspected of up to 70 violent sexual attacks in South East London attributed to the unidentified ""Green Chain Rapist"".",1990,1,3.0
Antonis Daglis,Greece,1992,1995,3,3,"""The Athens Ripper"". A serial rapist with antecedents for violence, Daglis upgraded to raping, strangling and dismembering three sex workers with a hacksaw in 1992, and tried to kill six more women. In his trial he claimed to hate all sex workers. Killed himself in prison in 1997.",1990,3,1.0
Gustavo Romero Tercero,Spain,1993,1998,3,3,"""The Valdepeñas Killer"". Armed robber and rapist, he killed a couple after the woman recognized him in 1993, and another woman in 1998 after accidentally hitting her with his car, fearing that a possible investigation would link him to the other crimes. Confessed and was sentenced to 83 years in prison for all crimes in 2003, after his ex-wife denounced him.",1990,5,0.6
Peter Bryan,United Kingdom,1993,2004,3,3,"A paranoid schizophrenic, Bryan was recluded in a mental institution after killing a shop assistant with a hammer in 1993. Released 11 years later after psychiatrists noted his ""continued improvement"", Bryan immediately killed a friend and was apprehended when he was frying his brains on a pan. Months later, Bryan killed a fellow mental patient, declaring that he didn't eat him solely because he was caught first. Currently imprisoned for life.",1990,11,0.2727272727272727
Lam Kwok-wai,Hong Kong,1993,2002,3,3,Convicted of 10 rapes and 3 murders that he committed with his bare hands. One of two only known serial killers in Hong Kong.,1990,9,0.3333333333333333
Dana Sue Gray,United States,1994,2003,3,3,Convicted of murder of three elderly women and attempted murder of a fourth in California.,1990,9,0.3333333333333333
Robin Ligus,United Kingdom,1994,2003,3,3,Died in a mental institution in 2012.,1990,9,0.3333333333333333
Jack Owen Spillman,United States,1994,1995,3,3,"Known as ""The Werewolf Butcher""; killed two girls and the mother of one of them in Washington State in 1994 and 1995.",1990,1,3.0
Scott Williams,United States,1997,2006,3,3,Killed and mutilated three women between 1997 and 2006. Sentenced to life.,1990,9,0.3333333333333333
Juan Covington,United States,1998,2005,3,3,Shot and killed 3 people.,1990,7,0.42857142857142855
Matthew James Harris,Australia,1998,2007,3,3,"Strangled a friend's brother, a female friend and a male neighbour to death over five weeks in 1998 in Wagga Wagga.",1990,9,0.3333333333333333
Yukio Yamaji,Japan,2000,2005,3,3,"Murdered his own mother in 2000, and then murdered a 27-year-old woman and her 19-year-old sister in 2005.",2000,5,0.6
Hiroshi Maeue,Japan,2005,2014,3,3,"Called the ""Suicide Website Murderer"" for finding his victims in an online suicide community. Maeue offered to painlessly kill themselves together by charcoal burning in a car, but once together he strangled them with his bare hands instead, as this excited him sexually. Hanged in 2009.",2000,9,0.3333333333333333
António Luís Costa,Portugal,2005,2006,3,3,"Ex-soldier, suffocated three women (and mutilated the first one) in Santa Comba Dao.",2000,1,3.0
Özgür Dengiz,Turkey,2007,2016,3,3,"Known as ""The Cannibal of Ankara"" for eating one of his victims; a third victim survived. Interned in a mental institution after his conviction to two life sentences was overturned.",2000,9,0.3333333333333333
Mario Alberto Sulú Canché,Mexico,2007,2008,3,3,Killed 3 women from 2007 to 2008; later committing suicide by hanging in prison.,2000,1,3.0
Joanna Dennehy,United Kingdom,2013,2022,3,3,"Carried out the Peterborough ditch murders. Over a period of two weeks, murdered her landlord and two of her house mates by stabbing them. With the help of accomplices she dumped the bodies in ditches, then attempted to kill two strangers in broad daylight by stabbing them. Given whole life tariff on 28 February 2014.",2010,9,0.3333333333333333
Kimberly McCarthy,United States,1988,1997,3,3,"Executed for murdering her neighbour, 71-year-old Dorothy Booth; DNA evidence proved she had murdered two other elderly women, but she was never charged.",1980,9,0.3333333333333333
David Burgess,United Kingdom,1966,1967,3,3,Stabbed and strangled three young girls in Beenham over a two-year period.,1960,1,3.0
Larry Hall,United States,1980,1994,2,50,"Hall traveled around the American Midwest as part of his interest in historical reenactments, which he would also use as a cover for stalking, raping, and murdering teenage girls. It is believed his first murders were committed when he was 18 years old. Although he was convicted of kidnapping 15-year-old Jessica Roach, Hall has never been charged with murder. Authorities have tied 15 murders to Hall, though only been able to confirm two, he has admitted to (and recanted) committing 39, though the FBI believes he could have committed as many as 50 in at least three states.",1980,14,0.14285714285714285
Alejandro Máynez,Mexico,1980,0,2,50,"Killed at least two women in Ciudad Juárez, but believed to be 50. Supposedly, along with Ana Benavides and Melchor Máynez.",1980,0,0.0
Billy Gohl,United States,1901,1913,2,90,"Alleged to have killed from 40 to 140 seamen in Aberdeen, Washington",1900,12,0.16666666666666666
Gerard John Schaefer,United States,1969,1973,2,30,"Florida police officer who killed up to 34 women and girls. Stabbed to death by fellow inmate Vincent Faustino Rivera on December 3, 1995.",1960,4,0.5
Macario Alcala Canchola,Mexico,1960,1962,2,12,"Known as ""Mexican Jack""; convicted of the murders of two sex workers but suspected of at least twelve more murders.",1960,2,1.0
Bruce Lindahl,United States,1974,1981,3,12,Accidentally killed himself while stabbing one of his victims; posthumously connected to various rape-murders in Dupage County.,1970,7,0.42857142857142855
Robert Zarinsky,United States,1958,1974,2,10,Killed people between 1958 and 1974.,1950,16,0.125
Ed Gein,United States,1954,1957,2,8,"Famous for his necrophiliac behaviours, as well as using/storing body parts of his victims to make household furniture, clothing and other miscellaneous household items.",1950,3,0.6666666666666666
José Luis Calva,Mexico,2007,2016,2,8,Killed and cannibalized women. Hanged himself in prison after being convicted to 84 years for two murders.,2000,9,0.2222222222222222
Shirley Winters,United States,1979,2007,2,7,"Confessed in 2008 to killing 2 children (including her 5-month old son), 27 years apart. Plea agreement for those murders included clause stopping investigation of her role in a fire that killed 2 previous children in 1979. Is also a suspect in a separate fire that killed 3 children of a friend in 1979.",1970,28,0.07142857142857142
Richard Rogers,United States,1973,1993,2,7,"Rogers, a gay man, was convicted of two murders and implicated by forensics in two others. He was also suspected of murdering two other men, and was charged but acquitted for murdering a college student in 1973.",1970,20,0.1
Rabidin Satir,Malaysia,2009,2012,2,6,"Nicknamed ""Rambo Bentong"". Rabidin had raped and murdered a 17-year-old schoolgirl Annie Kok Yin Cheng in March 2009 and battered 31-year-old forestry department employee Khairul Hazri Jamaludin to death in November 2012. Rabidin was convicted of both these murders and given two death sentences in 2014 and 2015 respectively. Rabidin was suspected of killing three to four more people: a nine-year-old girl, an elderly married couple in their 70s and a 63-year-old man between 2010 and 2012.",2000,3,0.6666666666666666
Castration serial murders,United States,1980,1986,2,5,"Unidentified perpetrator who kidnapped young men, castrated them and shot them in the back of the head. Forensics proved at least two of the victims were killed by the same person.",1980,6,0.3333333333333333
Steven Brian Pennell,United States,1987,1988,2,5,"Known as ""The Corridor Killer"" and ""The Route 40 Killer""; convicted of torture-murdering two women, pleaded no contest to two more and suspected of a fifth in Delaware in 1987 and 1988. Executed by lethal injection March 14, 1992.",1980,1,2.0
