Name,Country,Start year,End year,Proven victims,Possible victims,Notes,Decade,Career_Length,Victims_Per_Year
Luis Garavito,"Colombia, Ecuador, Venezuela",1992,1999,193,247,"Child-murderer, torture-killer, and rapist known as ""La Bestia"" (""The Beast""). Garavito confessed to killing 140 boys between six and sixteen years old, from October 1992 to April 1999 in Colombia and neighboring countries. He is suspected of murdering over 300 victims, mostly street children. Garavito was originally sentenced to 1,853 years in prison, but this was later reduced to 22 years, after he led police to many of the bodies of his victims. He was scheduled to become eligible for parole in 2023. He died on October 12, 2023.",1990,7,27.571428571428573
Pedro López,"Colombia, Peru, Ecuador",1969,1980,110,300,"Child-murderer and rapist, known as ""The Monster of the Andes"". López targeted young girls, between the ages of eight and twelve. Arrested in 1980 and convicted in 1983 of killing three young girls, but claimed to have killed hundreds. Despite being believed to be one of the most prolific serial killers of the twentieth century, he was released in the late 1990s.",1960,11,10.0
Javed Iqbal,Pakistan,1998,1999,100,100,"Child-murderer and rapist, known as ""Kukri"", Iqbal murdered 100 street children by strangling them and covering up his crimes by dissolving the bodies with acid. He was arrested in December 1999 after sending a letter to a newspaper, and was set to be executed in the manner described by the judge, who stated, ""You will be strangled to death in front of the parents whose children you killed"" and, ""Your body will then be cut into 100 pieces and put in acid, the same way you killed the children."" However, he died in custody before he could be executed.",1990,1,100.0
Mikhail Popkov,Russia,1992,2010,83,86,"Serial rapist-killer nicknamed ""The Werewolf"", who was active for two decades in Angarsk, Irkutsk and Vladivostok. After being convicted of 22 murders in 2015, he confessed to an additional 59 murders, of which he was convicted of 56 in 2018. In July 2020, Popkov confessed to more killings, bringing the total number of admitted victims to 83. He was convicted of additional two killings in 2021 and another three in 2023. He was sentenced to life.",1990,18,4.611111111111111
Daniel Camargo Barbosa,"Colombia, Ecuador, Brazil",1974,1986,72,180,"Child and woman murderer, believed to have possibly raped and killed over 150 victims, primarily targeting female children, as they were more likely to be virgins. Confessed to killing 72 victims. He strangled young girls in Colombia and was arrested, but he escaped from prison, and started killing in Ecuador. He was rearrested in 1986, and was allegedly incarcerated in the same Ecuadorian prison as 300+ serial killer Pedro López.[citation needed] Camargo was killed in jail by the nephew of one of his victims.",1970,12,6.0
Pedro Rodrigues Filho,Brazil,1967,2003,71,100,"Rodrigues Filho claimed to have killed over 100 victims, 47 of them inmates. He also killed his father (who had killed his mother) and ate a piece of his heart. He killed his first two victims at the age of 14. He was first arrested in 1973; he was convicted and sentenced to 128 years, but the maximum one can serve in Brazil is 30 years. He was released in 2018. He was murdered by two men in 2023.",1960,36,1.9722222222222223
Kampatimar Shankariya,India,1977,1978,70,70,"Shankariya was an Indian serial killer who used a hammer to kill over 70 men and women between 1978 and 1979. He was hanged in 1979; his last words were, ""I have murdered in vain"", he declared. ""Nobody should become like me.""",1970,1,70.0
Hoshang Amini,Iran,1954,1962,67,67,"Known as the ""Ghost of the Qanat Wells"". Murdered 67 people in the city of Varamin from 1954 to 1962, sometimes aided by accomplices. He earned his nickname by decapitating his victims post-mortem and then dumping their bodies into wells.",1950,8,8.375
Yang Xinhai,China,1999,2003,67,67,"Known as the ""Monster Killer"". Yang would enter victims' homes at night and kill using axes, meat cleavers, hammers, and shovels. He was executed by gunshot in 2004.",1990,4,16.75
Abul Djabar,Afghanistan,0,1970,65,300,"Killed 65 men and boys by strangling them with turbans while raping them. Suspected of over 300 murders. Sentenced to death and hanged on October 21, 1970.",0,0,0.0
Samuel Little,United States,1970,2005,60,93,"Little was convicted of killing three women, but later investigations linked 31 other murders to him. He claimed he killed as many as 93 victims total, three above his initial confession of 90; the FBI later confirmed a total of 60 murders linked to Little. The investigations into his crimes are ongoing. Sentenced to life imprisonment without the possibility of parole on September 25, 2014. Died in prison on December 30, 2020, aged 80.",1970,35,1.7142857142857142
William Unek,"Belgian Congo, Tanganyika",1954,1957,57,57,"Unek was a police constable who murdered 21 people with an axe in less than two hours before fleeing. Three years later, Unek, armed with rifle and axe, murdered 36 more people in the village of Malampaka before being mortally wounded by police with a smoke bomb that caught fire.",1950,3,19.0
Mohammed Bijeh,Iran,2002,2004,54,54,"Bijeh raped and killed at least 54 male children and teenagers. On November 27, 2004, he was sentenced to be executed. Bijeh said that if he was not arrested, he would kill 100 children. He was executed after being lashed in front of a crowd in 2005.",2000,2,27.0
Andrei Chikatilo,Soviet Union,1978,1990,53,56,"Known as ""The Butcher of Rostov"", ""The Red Ripper"" or ""The Rostov Ripper"". Chikatilo was convicted of the murder of 53 women and children between 1978 and 1990. One man was previously convicted and executed for his first murder. Chikatilo was executed by gunshot in 1994.",1970,12,4.416666666666667
Anatoly Onoprienko,"Soviet Union, Ukraine",1989,1996,52,52,"Known as ""The Beast of Ukraine"", ""The Terminator"", and ""Citizen O"". Onoprienko was convicted of the murders of nine people in 1989, and 43 people in 1995–1996. He travelled throughout Europe illegally from 1990 to 1995; whether he killed during this time is unknown. He was sentenced to death, and was later commuted to imprisonment for life. He died from heart failure in 2013.",1980,7,7.428571428571429
Florisvaldo de Oliveira,Brazil,1982,1983,50,50,"Known as ""Cabo Bruno""; de Oliveira was a former police officer and vigilante who murdered criminals in the outskirts of São Paulo. He was murdered by unknown assailants in 2012.",1980,1,50.0
Gary Ridgway,United States,1982,1998,49,80,"Ridgway was a truck painter who confessed to killing 71 women. He was also known as The ""Green River Killer"". He almost exclusively targeted sex workers from Seattle. Ridgway was suspected of killing over 90 victims; he confessed to 71, and was convicted of 49. He was sentenced to life without parole.",1980,16,3.0625
Alexander Pichushkin,Russia,1992,2006,49,60,"Pichushkin was also known as the ""Chessboard Killer"". He was convicted of murdering 49 victims, and suspected of killing 60. He claimed to have murdered 62 people, because he did not know that two of his victims had survived; he stated that his goal was becoming Russia's most prolific serial killer. He was sentenced to life imprisonment.",1990,14,3.5
Wang Qiang,China,1995,2003,45,60,Wang killed 45 and raped 10 from 1995 to 2003. He was executed by firing squad in 2005.,1990,8,5.625
Ahmad Suradji,Indonesia,1986,1997,42,42,Suradji was convicted of strangling at least 42 women and girls in a series of ritual slayings he believed would give him magical powers. He was executed by firing squad in 2008.,1980,11,3.8181818181818183
Raman Raghav,India,1965,1968,41,41,"In the late 1960s, Raghav went on a violent rampage in Mumbai, India. He bludgeoned 41 people to death inside their shelters while they slept. He died of kidney failure in 1995.",1960,3,13.666666666666666
Moses Sithole,South Africa,1994,1995,38,76,"Known as South Africa's Ted Bundy. Sithole preyed on unemployed women, posing as a businessman and luring his victims with the prospects of a job, before leading them to an isolated place, where he raped, tortured, and murdered them. He was sentenced to 2,410 years imprisonment, with a non-parole period of 930 years.",1990,1,38.0
Serhiy Tkach,"Soviet Union, Ukraine",1984,2005,37,100,"A former Ukrainian police criminal investigator, Tkach suffocated girls aged between eight and eighteen, and performed sexual acts on their bodies after they were dead. He claimed to have killed 100. He was sentenced to life imprisonment, and died from heart failure in 2018.",1980,21,1.7619047619047619
Gennady Mikhasevich,Soviet Union,1971,1985,36,49,"Mikhasevich killed women by strangling them. Besides killing, he also robbed his victims of money and valuable items (that he would sometimes give to his wife as a gift). He was executed by firing squad in 1987.",1970,14,2.5714285714285716
Hadj Mohammed Mesfewi,Morocco,0,1906,36,36,"Known as ""Marrakesh Arch-Killer""; Mesfewi drugged, mutilated and murdered women; he was executed by immurement (walling) in 1906.",0,0,0.0
Vera Renczi,"Kingdom of Romania, Yugoslavia, Hungary",1920,1930,35,35,"Romanian serial killer nicknamed, ""The Black Widow"". Renczi was convicted of killing 35 men through arsenic poisoning, but confessed to only killing 32 victims. Renczi is one of the world's most prolific female serial killers. However, there is very little information about Renczi and her crimes, because personal information (criminal history, academic records, etc.) were not cataloged as well as they are today, making some criminologists believe she was a figure of Romanian folklore, rather than an actual person.",1920,10,3.5
Fernando Hernández Leyva,Mexico,1982,1999,33,137,"Hernández Leyva confessed to 100 murders and six kidnappings at the time of his arrest in 1999 (he had been arrested previously in 1982 and 1986, the second time for murder, but escaped from prison), but later retracted, and claimed that he had been beaten by the police and his family threatened in order to force him to confess. He was accused of as many as 137 murders in five southern Mexican states, was convicted of 33 murders, and was sentenced to 50 years in prison. He tried unsuccessfully to commit suicide in prison. If his claim of 100+ victims were true, then Leyva would be Mexico's most prolific documented serial killer.",1980,17,1.9411764705882353
John Wayne Gacy,United States,1972,1978,33,39,"Gacy is known to have murdered a minimum of 33 teenage boys and young men between 1972 and 1978, 26 of whom he buried in the crawl space of his Chicago home. He was known as the ""Killer Clown"", due to the fact he often entertained children at social events dressed in a self devised clown costume. Executed by lethal injection in 1994.",1970,6,5.5
Ali Asghar Borujerdi,"Ottoman Empire, Iraq, Iran",1907,1934,33,33,"Known as ""Asghar the Murderer"". Borujerdi killed 33 young adults in Iraq and Iran. He was executed by hanging in 1934.",1900,27,1.2222222222222223
Vasili Komaroff,Soviet Union,1921,1923,33,33,"Known as ""The Wolf of Moscow""; Komaroff was a horse trader who killed 33 men. He was executed by firing squad in 1923.",1920,2,16.5
Ramadan Abdel Rehim Mansour,Egypt,1999,2006,32,32,"Mansour was a gang leader known as ""al-Tourbini"" (""The Express Train""). He had raped and tortured homeless children, mostly boys aged 10 to 14 years old, aboard the trains between Cairo, Alexandria, Qalyubia, and Beni Sueif. The victims were usually thrown off the moving train when they were dead or in agony; other times, they were thrown into the Nile or buried alive. Mansour was executed in 2010.",1990,7,4.571428571428571
Radik Tagirov,Russia,2011,2012,31,31,"Known as the ""Volga Maniac"". He murdered elderly women in several Russian regions.",2010,1,31.0
Karl Denke,Germany,1900,1924,30,42,"Killed and cannibalized poor travelers and homeless vagrants. Kept a ledger recording his murders with at least 31 names in it (including Vincenz Olivier, his only surviving victim), thus confirming at least 30 victims. But due to the massive amount of human remains found in his apartment, his kill count is suspected by many to exceed 42 victims. Killed himself by hanging in his holding cell before he could be tried.",1900,24,1.25
Francisco das Chagas Rodrigues de Brito,Brazil,1989,2003,30,42,"Serial killer of children, who also sexually abused and mutilated children in Maranhão and Pará; sentenced to 217 years imprisonment.",1980,14,2.142857142857143
Monster of the Mangones,Colombia,1963,1970,30,38,"Unidentified serial killer(s) who kidnapped, tortured, raped, and murdered at least 30 boys in Cali, Colombia.",1960,7,4.285714285714286
Milton Sipalo,Zambia,1980,1989,30,31,"Known as ""The Lusaka Strangler""; A soldier who raped and murdered women and girls in Lusaka. While awaiting trial, he jumped off of the roof of the police station where he was being interrogated, killing himself.",1980,9,3.3333333333333335
Luis Gregorio Ramírez Maestre,Colombia,2010,2012,30,30,Killed motorists in various municipalities before his 2012 capture. Was sentenced to 34 years in prison.,2010,2,15.0
David Thabo Simelane,Swaziland,2000,2001,28,45,"Sexually assaulted women he befriended in forests, stabbing or strangling them afterward; sentenced to death.",2000,1,28.0
Zhang Jun,China,1993,2000,28,28,"Robbed 22 stores in several Chinese provinces, killing 28 people in the process. Executed in 2001.",1990,7,4.0
Mariam Soulakiotis,Greece,1939,1951,27,177,"Known as ""Mother Rasputin""; abbess believed to have murdered wealthy women and children who came into her abbey. The true number of her victims is a matter of debate, but she was found guilty of 177 murders—150 through negligence (fraudulently claiming to offer free tuberculosis treatment when the 'treatment' only consisted of abiding in her high altitude convent) and 27 through starvation. Died in prison in 1954.",1930,12,2.25
Cedric Maake,South Africa,1996,1997,27,35,"Known as the ""Wemmer Pan Killer"" and ""Hammer Killer"". He killed his victims with different instruments such as guns, rocks, a knife, and a hammer. Authorities attributed the murders to two serial killers because of the inconsistent modus operandi. In some cases he killed his victims with a rock, in others he shot them, and in others he murdered tailors with a hammer. Maake was arrested after Moses Sithole was found guilty of 38 killings and sentenced to 1,340 years in prison.",1990,1,27.0
Robert Pickton,Canada,1983,2002,26,49,"Known as the ""Pig Farmer Killer"" or the ""Butcher"", he killed women from mostly the Vancouver Downtown Eastside and would feed the remains to the pigs on his farm. In 2007, he was initially convicted for the deaths of 6 woman, but was later found guilty of the deaths of 20 other woman in 2010; however he confessed to 49 killings to an undercover police officer. In 2024, Pickton died of injuries received in an attack from another inmate.",1980,19,1.368421052631579
Bruce George Peter Lee,United Kingdom,1973,1979,26,26,"Epileptic arsonist who killed people in the city of Hull; sentenced to life imprisonment, but was later institutionalized.",1970,6,4.333333333333333
The Stoneman,India,1985,1989,25,25,"12 homeless people were murdered in their sleep in Bombay between 1985 and 1987, and 13 in Calcutta in 1989—in all cases, by dropping a large rock over their head (an additional victim escaped, but could not identify the attacker). No one was ever charged with any of the murders.",1980,4,6.25
Juan Corona,United States,1971,1980,25,25,Corona was convicted of murdering ranch laborers and burying them in orchards. He was sentenced to 25 terms life imprisonment. Died from natural causes in 2019.,1970,9,2.7777777777777777
Fritz Haarmann,Germany,1918,1924,24,27,"Also known as the Butcher of Hanover and the Vampire of Hanover, because of his preferred method of killing by biting through his victim's throat, sometimes while sodomizing them. He would then dump the bodies in the nearby river Leine. Believed to have been responsible for the murder of 27 boys and young men, he was convicted, found guilty of 24 murders and executed by guillotine in 1925.",1910,6,4.0
Béla Kiss,Austria-Hungary,1912,1916,24,24,"Evaded arrest and conviction after the discovery of 24 bodies hidden in large metal drums on his property in 1916. At that time he was serving in the Austro-Hungarian Army, and deserted when the military was notified of the murders by civilian authorities. His final whereabouts and fate are unknown, as is his final victim count.",1910,4,6.0
Majid Salek Mohammadi,Iran,1981,1985,24,24,"Killed mainly women he considered unfaithful to their husbands, sometimes the children accompanying them too; killed himself before he could be sentenced.",1980,4,6.0
Yvan Keller,"France, Germany, Switzerland",1989,2006,23,150,"Known as the ""Pillow Killer""; killed and robbed old women in France's Alsace region, but also confessed to up to 150 murders, including in Germany and Switzerland; killed himself before trial.",1980,17,1.3529411764705883
Ronald Dominique,United States,1997,2006,23,23,"Louisianian serial killer, known locally as the Bayou Strangler and murdered victims in the Terrebonne Parish, Lafourche Parish, Iberville Parish and Jefferson Parish. Sentenced to eight life terms.",1990,9,2.5555555555555554
Juan Fernando Hermosa,Ecuador,1991,1992,23,23,"Known as ""Niño del Terror""; youth gang leader who murdered mostly taxi drivers and homosexuals in Quito; murdered on his 20th birthday by unknown assailants.",1990,1,23.0
Gerald Stano,United States,1969,1980,22,88,"Confessed to killing 41 women, mostly in Florida and New Jersey. He was only convicted in 22 cases, and is suspected in the deaths of up to 88 victims. Some people have suggested that Stano was a serial confessor.",1960,11,2.0
Earle Nelson,"United States, Canada",1926,1927,22,25,"Necrophiliac who primarily targeted boarding house landladies on the US West Coast during 1926; he was also known as ""Gorilla Killer"" or ""the Dark Strangler"". Captured after two murders in a small (now ghost) town in southern Manitoba. Found guilty, hanged by Canadian authorities in January 1928.",1920,1,22.0
Mikhail Novosyolov,"Soviet Union, Russia, Tajikistan",1977,1995,22,22,"Known as the ""Necrophile Rebel""; killed his victims with blows from heavy objects, then had sexual intercourse with their corpses; sentenced to civil commitment.",1970,18,1.2222222222222223
Manuel Octavio Bermúdez,Colombia,1999,2003,21,50,"Colombian child rapist and serial killer. Known as ""El Monstruo de los Cañaduzales"" (The Monster of the Cane Fields). He confessed to killing 21 children in remote areas of Colombia. Sentenced to 40 years in prison.",1990,4,5.25
Patrick Kearney,United States,1965,1977,21,43,"Would pick up young male hitch-hikers or young men from gay bars near Redondo Beach, California, and kill them. Sentenced to imprisonment for life.",1960,12,1.75
William Bonin,United States,1979,1980,21,36,"Bonin and three accomplices are known to have murdered a minimum of 21 youths aged between 12 and 19 in and around Los Angeles. As the majority of his victims were discarded alongside various southern California freeways, Bonin became known as the Freeway Killer. Convicted of 14 of the freeway murders, he was executed by lethal injection in 1996.",1970,1,21.0
Vasile Tcaciuc,Romania,1917,1935,21,26,Romanian man who lured victims and then murdered them with an axe. He was arrested in 1935 after a dog found a dead body in his house. He confessed to having committed at least 26 murders. He was shot dead by a policeman while trying to escape from prison.,1910,18,1.1666666666666667
Yoo Young-chul,South Korea,2003,2004,21,26,"Used a hammer to murder mostly older victims, until his focus shifted to the decapitation and mutilation of escorts after being dumped by a girlfriend who worked in that profession. Was sentenced to death and currently incarcerated.",2000,1,21.0
Francisco Guerrero Pérez,Mexico,1880,1908,21,21,"Known as ""El Chaquero""; the first captured serial killer in Mexico, who killed sex workers in Mexico City; died in 1910 from cerebral thromboembolism and another, unspecified cause.",1880,28,0.75
Ted Bundy,United States,1974,1978,20,67,"Bundy was an American serial killer known for his charisma and good looks. He officially confessed to 30 homicides, but had confessed to killing 35–36 women in the past, and some estimates run upwards of 100 or more. He was infamous for escaping from prison twice and murdering multiple victims in one day; sometimes abducting women from the same location within hours of one another. He was executed by electric chair in 1989.",1970,4,5.0
Abdullah Shah,Afghanistan,1990,0,20,20,"Killed travelers on the road from Kabul to Jalalabad serving under Zardad Khan. Also killed his wife. Executed on April 20, 2004.",1990,0,0.0
Mohan Kumar,India,2005,2009,20,20,"Lured female victims with promises of marriage and gave them cyanide, claiming they were contraceptive pills, Sentenced to death in 2013.",2000,4,5.0
Bulelani Mabhayi,South Africa,2007,2012,20,20,"Known as the ""Monster of Thuleni""; killed 20 women and children from 2007 to 2012. Sentenced to 25 life sentences on September 3, 2013.",2000,5,4.0
Larry Eyler,United States,1982,1984,19,23,"Known as ""The Interstate Killer""; sentenced to death for the 1984 murder and dismemberment of 15-year-old Daniel Bridges. He confessed to other homicides of young men and boys in five separate states. Died of AIDS complications in 1994.",1980,2,9.5
Cape Town Prostitute Killer,South Africa,1992,1996,19,20,"Unidentified serial killer who, on rainy nights, picked up sex workers and domestic workers in his vehicle, strangled them in parking lots, and dumped their bodies in rural, preselected spots.",1990,4,4.75
"""El Psicópata""",Costa Rica,1986,1996,19,19,"(""The Psychopath"") Unidentified serial killer who killed 19 people with an M3 submachine gun in three Costa Rican towns, always south of the Florencio del Castillo Highway.",1980,10,1.9
Sergei Ryakhovsky,"Soviet Union, Russia",1988,1993,19,19,"Known as the Balashikha Ripper, he was convicted for the murders of at least 19 victims. Died from tuberculosis in 2005.",1980,5,3.8
Yevgeny Chuplinsky,Russia,1998,2006,19,19,"Known as the ""Novosibirsk Maniac""; killed sex workers in Novosibirsk; despite extensive police search and the capture of another serial killer, he was only arrested in 2016; sentenced to life imprisonment.",1990,8,2.375
M. Jaishankar,India,2008,2011,19,19,"Accused of killing at least 19 women. Charged with 13 murders, he escaped during a trial transport. Killed eight more people in two months before he was recaptured. Sentenced to 27 years. Killed himself by slashing his wrists with a shaving blade in prison on 27 February 2018.",2000,3,6.333333333333333
Ansis Kaupēns,Latvia,1920,1926,19,19,Army deserter who committed 30 robberies and killed 19 people; one of the most infamous Latvian criminals; executed by hanging in 1927.,1920,6,3.1666666666666665
Vadim Ershov,Russia,1992,1995,19,19,"Known as the ""Krasnoyarsk Beast""; committed 70 crimes around the Krasnoyarsk area, including 19 murders and eight attempted murders; sentenced to death, commuted to life imprisonment.",1990,3,6.333333333333333
Velaphi Ndlangamandla,South Africa,1998,2007,19,19,"Known as ""The Saloon Killer""; robber who murdered people around Mpumalanga in his crime spree; sentenced to 137 years imprisonment.",1990,9,2.111111111111111
Valery Kopytov,Russia,2000,2004,19,19,"Known as ""The Barnaul Chikatilo""; homeless man who killed other homeless people in Altai Krai.",2000,4,4.75
Randall Woodfield,United States,1979,1981,18,44,"Known as ""The I-5 Killer"" and ""The I-5 Bandit."" Suspected of as many as 44 murders. Sentenced to imprisonment for life.",1970,2,9.0
Yavuz Yapıcıoğlu,Turkey,1994,2002,18,40,Killed in various cities of Turkey. 18 murders proven and accused of more than 40 by eyewitnesses and relatives. Was sentenced to 74 years in prison.,1990,8,2.25
Paul John Knowles,United States,1974,1983,18,35,"Killed 18 people in various states in 1974. Claimed 35 murders. Known as the ""Casanova Killer""; shot dead by FBI agents.",1970,9,2.0
Thierry Paulin,France,1984,1987,18,21,"Known as ""The monster of Montmartre"". Killed and robbed elderly women. Died of AIDS in 1989 in prison before trial.",1980,3,6.0
Richard Nyauza,South Africa,2002,2006,18,19,"Known as ""The Quarry Murderer""; bludgeoned, beat, strangled, and stabbed 16 women and two unborn children to death and left their bodies in or around a quarry. Given 16 life sentences.",2000,4,4.5
Umesh Reddy,India,1996,2002,18,18,Confessed to 18 rapes and murders. Sentenced to death.,1990,6,3.0
Christopher Mhlengwa Zikode,South Africa,1994,1995,18,18,"Known as ""Donnybrook Serial Killer"" murdered 18 people in Donnybrook, KwaZulu Natal from 1994 to 1995. Was given 140 years (5 life sentences).",1990,1,18.0
Kotakethana murders,Sri Lanka,2008,2015,18,18,18 mysterious murders of women in the Rathnapura district of Sri Lanka. One middle age man suspect was arrested in 2015 and his DNA matched with six murders. Nine other cases remain unsolved.,2000,7,2.5714285714285716
Asande Baninzi,South Africa,2001,2010,18,18,"Killed 18 people in three months, including a family of four; given 19 life sentences and 189 years of imprisonment.",2000,9,2.0
Vladimir Mirgorod,Russia,2002,2004,18,18,"Known as ""The Strangler""; raped and strangle women in Moscow, also killing one of the victims' son; sentenced to life imprisonment.",2000,2,9.0
